{
  "format": "readpack-translation",
  "format_version": "2.0",
  "article": {
    "id": "44444444-4444-4444-8444-444444444444",
    "revision": 1
  },
  "structure_sha256": "f31b435b32ab0294ecb0ab6ffacf96e6fcb103ce34dea83062baffcb0220bbbb",
  "target_locale": "zh-Hans",
  "sentences": [
    {
      "sentence_id": "sentence-1",
      "text": "分层示例。"
    },
    {
      "sentence_id": "sentence-2",
      "text": "该包把原文与派生物分开保存。"
    },
    {
      "sentence_id": "sentence-3",
      "text": "详见 https://engirdle.example/schemas 。"
    }
  ],
  "tables": [
    {
      "block_id": "block-3",
      "cells": [
        {
          "cell_id": "cell-3-0",
          "text": "层"
        },
        {
          "cell_id": "cell-3-1",
          "text": "文件"
        },
        {
          "cell_id": "cell-3-2",
          "text": "基座"
        },
        {
          "cell_id": "cell-3-3",
          "text": "article.json"
        }
      ]
    }
  ],
  "pipeline": {
    "provider": "deepseek",
    "model": "deepseek-v4-flash",
    "prompt": "full-article-sequential-units@v2",
    "thinking": "enabled",
    "reasoning_effort": "max",
    "created_at": "2026-08-24T08:00:00Z",
    "client_version": "0.1.0"
  }
}
